"SVM_LABEL","SVM_PROB","sentiment_nya","tweet"
"2",0.516376948236098,"Positive","MSFT NFLX FCEL amp GME were the plays todayAnother fantastic day to continue the hot streak AAPL MSFT AMZN FB NFLX NVDA TSLA GOOGL QQQ SPY DIA AMD ZM BYND BA BABA DAL WMT HD GS COST MA PG"
"2",0.544984552461894,"Positive","Listening toearnings call I decided to look at some other stocks in my portfolio Folks makepart of your daily routine The info is out there AMDPLUG BE TWLO LSCC JIMAPLTR"
"1",0.524742727960903,"Negative","Did you dump those AMD at close"
"2",0.522138286311286,"Positive","AMD still too cheap if your long EOY hold"
"1",0.50880667124703,"Neutral","AMD Juicy upgrades tomorrow"
"1",0.521468552865942,"Negative","AMDEOY easyLONG and strong"
"2",0.504437237234828,"Neutral","AMD Earning perfect beat recordnot so good for INTCcould be a nice shorttomorrow down"
"2",0.511564245921902,"Positive","AMD Buy op for Newbs right here"
"2",0.503183200150835,"Neutral","Daily Market Wrap for Charts Reviewed SPX SPY ESF MESF QQQ IWM XLF AAPL TSLA WKHS BLNK SNOW PLTR FUBO BIDU NVDA AMD MSFT SBUX GMEstocks optionstrading stockmarket futurestrading success"
"1",0.514035098142778,"Negative","AMDinside day chopping after their report tonight"
"1",0.607597211482064,"Negative","Lots of good names in this spaceNVDA AMD QCOM AVGO MU LRCX amp TSM just to name a fewIm long AMD and have smaller position in QCOMTSM really executes well as a company Solid growth reasonable debt levels amp hugely profitable I like all these names really"
"2",0.506358103213722,"Neutral","AMD is starting really piss me offGreat quarter and still stuck in the god damn mudThen you a dinosaur company like GME explode and Im double pissed off"
"1",0.528435449869911,"Negative","Anyone heard of thesenew altcoins GME and AMDLemme know"
"2",0.605730358381703,"Positive","Fun day todaymakes the good ones easier to spotthey hold up the best RelativeStrengthbest ‘indicator’ there is Few from notes tonightPLTRCRSRJMIAUPWKNK AIRKTVUZI DDDSILAZR SUMODDOGBCABMRVIAMDBLNKZMTSLATDOCCLNENight all"
"1",0.569228241124244,"Negative","ADMP traders just keep LOW TWTR LLY ABMD RHT MCD TTWO UTX CL DWDP PEP PYPL CELG COST TE MMM ETE SLB ASML PNC CVS BABA MGM LVS CHK ACB HMNY SQ VALE TE PSSI JD BZUN TSM HD FNMA DRYS AMD CAT EBAY IBM GDX LVS V C"
"1",0.619287023418227,"Negative","I remember when things like earnings for MSFT and AMD mattered Now a days its OMG GME up another"
"1",0.514098275502547,"Negative","Buying more AAPL and AMD dip"
"1",0.52616538590204,"Negative","AMD beats earnings forecast on strong gaming and data center chip salesAMD AMD"
"1",0.508415934711809,"Neutral","AMD Revised AnalysisI am seeing potential for AMD to targetby midJune ampbetween"
"1",0.529778964325496,"Negative","AMD is seriously knocking his head on after stellar earnings and then FLOP"
"1",0.503490690790055,"Neutral","If you ever been with amd you shall see it spike indays Don’t wanna bet but I am averaging down"
"2",0.55317668807086,"Positive","Madeon OEG but only got half filled thereon BB after hours Took it small size only riskingHad EXT orders out for AMD so took a little off atanticipating the earnings whip ZM dropped my PL quite a bit but still up overall Keeping the stop tight"
"1",0.546858723604521,"Negative","Only a few days left to take advantage of this free trial Visitto sign up for the FREE TA Trades trial this weekgme amd msft nnox bbby amc bynd wkhs nio dkng ba"
"2",0.555696270539829,"Positive","Our Members had a great day on MarketNAKD TSLA AAPL NIO SPY QCOM ABNB NIO KGC PTON ZM ZOM FCEL FEYE F AAL PLTR CCL MSFT PFE PLUGAMD VXX CNSP MVIS SNAP QQQ GMECRBP OXY ET EWZ IWM"
"2",0.503626010883294,"Neutral","Consistent Progress Visit Our community for more details SPY TSLA SHOP AMZN NVDA ROKU EBAY AMD BB DAL DOW QQQ ZNGA AAPL ESE SPCE FCEL TRIP BYND MRNA NOK OXY CCL CRON DGLY PENN GMBL CRM BA WKHS INO TWTR WWR GME"
"2",0.508460142780734,"Neutral","SPY TSLA SHOP AMZN NVDA ROKU EBAY AMD BB DAL DOW QQQ AAPL ESE SPCE FCEL TRIP BYND MRNA NOK OXY CRON DGLY PENN GMBL CRM BA WKHS INO TWTR WWR"
"1",0.508466559499365,"Neutral","AMDAdvanced Micro Devices Q Adj EPSBeatsEstimate Sales B Beat B Estimate AMD earnings"
"1",0.531168374577151,"Negative","After Hours GameStop rockets on Elon Musk tweet Microsoft breaks out on strong earnings lifting futuresGME MSFT AMD PLTR AMZN AAPL TSLA"
"2",0.528128406029115,"Positive","I agree AMD reported great earnings and guidance but down slightly after hours"
"2",0.53422876493972,"Positive","Some big names reporting earnings this week Should be fun AAPL TSLA AMD FB MSFT JNJ GE BAAAL MCD ABT V SBUX CAT LUV LLY T VZ"
"1",0.618567736216668,"Negative","amd nailed q So why it just dipped in afterhr tradingXboxes and PS were the big gifts during xmas Mi figure sehwas the least"
"1",0.589226704681743,"Negative","AMZN also launched GravitonARM CPU inreducing its costs of production and completely cutting out INTC and AMDAMZN produces its own chips for AWS therefore drastically reducing purchasing expenses"
"1",0.637196934465602,"Negative","Empowering the Retail Traders with Artificial Intelligence Tradytics lets you leverage Artificial Intelligence and Data Analytics to tap into the kind of knowledge that is only accessible to the big guns on Wall StreetGME AMC BB NOK MSFT AMD AAPL"
"1",0.519441962069192,"Negative","Blowout Quarter for AMD"
"2",0.513085459848006,"Positive","WEEK FREE TRIAL FOR THE DISCORD JOIN WITH THE LINK BELOW MASSIVE WINNERS DAILY SPY AAPL MSFT GOOG GME PLTR BB AMD NFLX"
"2",0.532078873119748,"Positive","NASDAQNASDAQ JanTopStockMarket Sell Flow Stocks Animated AAPL AMD FB Apple Advanced Micro Devices Facebook"
"2",0.547954901166423,"Positive","SampPSP JanTopStockMarket Sell Flow Stocks Animated AAPL AMD FB Apple Advanced Micro Devices Facebook SPX SPY"
"1",0.513974765243585,"Negative","AMD Q FY earningsFY GuidanceYYStrong quarter driven by Ryzen EPYC and SemiCustom"
"1",0.540754402924606,"Negative","AMD is going to CRUSHin a massive short squeeze I can feel it in my body"
"1",0.519230779613499,"Negative","AFTER HOURS EARNINGS MOVERS MSFT SBUX AMD TXN"
"1",0.525109030007104,"Negative","AMD EXPECTS GAMING CONSOLE CHIP SALES TO BE ABOVE NORMAL SEASONAL LEVELS IN FIRST QUARTER ON STRONG DEMAND SAYS IS ON TRACK TO RELEASE MILAN SERVER CPU CHIP IN MARCHCEO IN CONFERENCE CALLAMD"
"1",0.513406468112793,"Negative","Stocks Pause As Inflation Expectations Slump A Diverging TaleMSFT AMD SBUX SQ rinf stocks StocksToWatch StockMarket trading"
"1",0.503454518456424,"Neutral","The Real Numbers Behind AMD RevealedAMDAdvancedMicroDevices"
"1",0.514269707007184,"Negative","Go AMD"
"2",0.551780319063319,"Positive","Favorite names on radar next weekPRPL SNAP SE IPHI AMD U AMZN FCXNot a lot of solid setups out there as many leaders are in corrective phase Focus list amp current positions can be found on Page Spotlight chartsAMD IPHI SNAP U"
"1",0.514155414641793,"Negative","AMDTook profitsampPosition closed"
"1",0.503276973834584,"Neutral","AMD Focus List NameNice flag breakout here early in the day"
"1",0.514212558558255,"Negative","amd i tal"
"1",0.514805820266719,"Negative","AMD “Milan” production began in Q’ with initial shipments to cloud and HPC customers AMD remains on track to launch rd Gen EPYC “Milan” server processors in Marchwith very strong ecosystem support"
"1",0.503077666508328,"Neutral","AMD sets record for server processor revenue in Q’ as both cloud and enterprise sales grew sequentially"
"1",0.513584232282571,"Negative","AMD AMD Kao Data to Host InstaDeep’s HPC and AI Supercomputer Expanding RampD Capabilities"
"1",0.514041140982216,"Negative","AMD to the infinity until Intel proven defeat"
"1",0.51934588576703,"Negative","AMD Ingresos M vs M est EPSvsestAMDafter hours"
"1",0.514231292760941,"Negative","Big day for Founder Favorite AMD Can’t complain with a beat Future looks super bright and will remain a staple in our portfolios"
"1",0.518354356714703,"Negative","This is a legacy I am happy to be part of Entered and made some money off of GME WSB thank youfintwitter AMC FUBo AMD AAPL TSLA is there GMEQ yet cheers my mentorsatlas community"
"1",0.549654251570581,"Negative","I’ve owned two stocks for a while that reported todayGE missed EPS bybut beat revs and had blowout FCF It was upon the newsAMD reported beating earnings revenue and forecast strong growth ahead It’s upAHWHAT AM I DOING WRONG TO NOT GETPER DAY"
"1",0.527676437892005,"Negative","AMD results and outlook both topped Wall Street estimateWall Street will punish good results tomorrow"
"1",0.563644461194482,"Negative","I started trimming and scraping profits last week and continue to do so this weekToday I trimmed MRNA and JNJ CsYesterday it was AAPLTomorrow it might be AMD"
"1",0.512160169144132,"Negative","Notable stocks that are trading nearbelow MA levels StocksToWatch stocks  DMA UBER DIS FTCH U PINS NVCR NET DOCU FVRR LOB OKTA TWLO SHOP CRSR ZS GSHD AMD DMA WMT SQ STNE BILL TTD SNOW Week ZM CRM COST NVDA LULU"
"1",0.528852788471451,"Negative","Bought Jancalls at the close onAMD MSFT Holding NVDA and losing NFLX and losing Need a pop on these tomorrow They expire FridayWatching AAPL tomorrow for an earnings play"
"1",0.578063637735107,"Negative","Looks like GME shareholders are picking RKT amp BB for their next X baggers TSLA TSLA NIO AMD MSFT NOK GE WallStreet Stocks StockMarket wallstreetbets WSB"
"1",0.528508970252398,"Negative","haha right AMD should be a win tomorrow dont see how the short call holds much value at all but the long call definitely willmight look into selling FEB to remain bullish if the premium is nice"
"1",0.52139682940609,"Negative","What about AMD vs INTCI was reading Quality Investing and saw an interesting nuance Its not about being in a duopoly its about being in an oligopoly Duopolies are lightning rods for competition and furthermore there is a case study on the ratings agencies"
"1",0.518718434352005,"Negative","amd hrIf the drop is controlled first half of day Dump n pump"
"2",0.503046816547295,"Neutral","I swung calls on AAPL FB TSLA AMC BBBY All up after hours Also swung AMD puts Slightly down after hours Gonna ride the run up and secure the bag before earnings If we gap up hard tomorrow ill be done trading early SwingTrading optionstrading"
"2",0.513410837409297,"Positive","AMD Baby He called another one"
"2",0.580205583625328,"Positive","I was bred by WSB AMD subfaggie delights ScienceGuyyou love to see it"
"1",0.519968208726442,"Negative","HeyI meant to long AMC not AMD Can you please send me my money back"
"2",0.50034034303165,"Neutral","So AMD beats estimates and dumps after hours I’ll close it out for a loss tomorrow and as soon as I do the stock price will probably shoot up"
"2",0.512867323826168,"Positive","Puts heldGMECalls heldRIOTTSLA SPY BABACGC FUBOIBMLI MSFTSBUX WKHS AAPLAMD AQBFBHEXO ITPMITTMNKD SIRISOSTTCF VRMWKHS"
"2",0.502024370050805,"Neutral","AMD coiling nicely here after hoursI think we dump in the morning then blast off from there"
"1",0.545227418987406,"Negative","Current big holdings AMDUALAMD size smaller holdings especially after trimming today TWTRFSR"
"2",0.563968392520408,"Positive","Tomorrow will be a record breaking day for chips AMD NVDA INTC TXN bears will be deleted from this earth"
"1",0.573815364837827,"Negative","I like INTC TXN and AMDNot equally doe capitalgames"
"1",0.502497212965483,"Neutral","AMD Advanced Micro beats bybeats on revs guides Q revs above consensus guides FY revs above consensus"
"1",0.513761115495573,"Negative","AMD Advanced Micro Earnings Preview chipmaker has been seeing huge growth recently"
"1",0.502608616821945,"Neutral","Heres what was most discussed in Reddits Wallstreetbets Tomorrows Moves thread for GME BB PLTR AAPL TSLA AMD NIO NOK AMC ICLN MSFT CCIV SPCE SPYSourceupdwp"
"2",0.568315624875712,"Positive","AMD beats er and upbeat guidance and it still crashes Wtf"
"1",0.503751700364766,"Neutral","AMD nice recovery after hours Maybe we’ll see thatagain"
"1",0.514041140982216,"Negative","AAPL AMD AMZN BA BYND DISsign up at"
"1",0.518846581117265,"Negative","Meme stock amd trying to justify B valuationIf they presented on Shark Tank asking for that valuation they’d be laughed at"
"1",0.532518624448001,"Negative","Wow did AMD ER happenreallyReallyMMsyou there Really"
"1",0.503000536822797,"Neutral","Earnings to watch this weekTuesday AMD MSFT SBUXWednesday BA AAPL TSLA FBThursday MCD AAL VFriday CAT"
"1",0.514269707007184,"Negative","AMDh"
"1",0.507435735324228,"Neutral","AMD will be fine This anomaly kind of stole its thunder but the market will correct and technicals will win out I increased position on KODK but have increased positions across portfolio on stocks that have no biz being down AH as they are being liquidated to cover or chase"
"2",0.522794885409976,"Positive","Classic amd great results but takes a dump anyway"
"2",0.625568158968024,"Positive","AMD Q earnings Guide at Qearnings was B revenue for Q and B for the full year Also the forward projection from the last analyst day wasyear over year growth Large beats on all those metrics Stock moving a lot after hittingit was briefly negative"
"1",0.514208838663084,"Negative","AMDGood news"
"1",0.500038671173659,"Neutral","AMD A big flop after earnings but still holding the closing level"
"1",0.55304086466956,"Negative","AMD Lotto weekly Call holders be like"
"1",0.514155414641793,"Negative","amdCome on with yo funky ass"
"2",0.532844505468201,"Positive","AMD Massive beat and guidance raise from Also the XLNX deal is expected to be closed in FY which means they haven’t been added to guidance yetLooks great for the future here I am longcalls"
"1",0.543251415094983,"Negative","Whats next for AMD after beating Intel AMDSPY"
"2",0.536654826683098,"Positive","can you please give retail investors aamd has flatline since AUGUSTConservative guidancedoes nothing for owners of this stock We are not holding for another year"
"2",0.615577036053181,"Positive","Reason amd stock isis because ceo continues to give conservative guidance and not give any reason for investors to get excited Great way to cover your asses but terrible for stock Conference call was analysts asking for more guidance and question whyare not higher"
"1",0.545804910271043,"Negative","NVDA and INTC dont have a high volume console revenue stream has lower gross margins but good operating marginsmeasure the GM of allcompanies in the pastyears and you will see what AMD has been doing"
"2",0.559280174529772,"Positive","the leader is now on a recovery pathIntel is only leading in size and promises right now AMD calls forgrowth inand Intel wont post a FY forecast"
"2",0.605970063426837,"Positive","AMD Advanced Micro Devices reported fourthquarter earnings above the Streets expectations late Tuesday The chip maker also said its expectingto be a good year for the company and is projecting fullyear growth well above what investors previously expected"
"2",0.516761278693883,"Positive","GME NOK BB PLTR TSLA AMD AAPL BBBY SPCE MSFT welcome to the wallstreetbets era"
"1",0.50312504750716,"Neutral","INFOGRAPHIC Key highlights from AMD Qearnings results semiconductors earnings markets investing wallstreet"
"1",0.54228712108315,"Negative","you are always ahead of market atleast a month or two check your previous debit spread picks sfix and gme both times we lost money doing those debit spreads and now they are mutlibaggernow AMD probably a scratch tomorrow butmonths later AMD at"
"2",0.589112134244568,"Positive","So todayWinnersAMD winnerunless something happens will be a loser tomorrow or break evenNKLAbig winnerleft runners can keep going or backtest breakoutAAPLwinnerup AH be surprised if doesnt hold or go higher in the AM"
"1",0.617406728946452,"Negative","Ill be selling these AAPL calls tomorrow Id imagine we get a ramp but Im not doing earnings again never ceases to amaze meAMD nothing short of amazing results w even better guidance and cant catch a bidCant say Im surprised but still its a friendly reminder"
"1",0.540605090947236,"Negative","AMDexpects abnormal console chip says above normalLets sell itI dont have alot ofin the trade but its the principle shit always annoys meThat was a blowout earningsguidance"
"1",0.514098275502547,"Negative","WrapAlertsPRTS gtNew MYOVAll Timestamped"
"1",0.508687701075236,"Neutral","CLOV AMD MSFT AAPL current holds"
"1",0.514269707007184,"Negative","AMD"
"1",0.519033545262807,"Negative","AITX DKNG RUN SQ AMD GamblingTwitter NFL NBA CBB ”Everybody Eats”"
"1",0.514041140982216,"Negative","AMD EPSBeatsEstimate Sales B Beat B Estimate"
"1",0.508921010025448,"Neutral","AMD to the moon"
"2",0.601916049703416,"Positive","Why is it that AMD ‘s strong beat and great BYND news still cause only small blips in stock price and fizzes out What should be the game plan for mid term investor here"
"1",0.539505152472471,"Negative","are you long AMD"
"1",0.531737880079036,"Negative","AMDClosedhitbefore numbers then down toafter numbers now back at PE at"
"1",0.524791419149976,"Negative","AMDup already"
"1",0.508574328192867,"Neutral","AMD Beat Expected Earnings in the Fourth Quarter and Sees a StrongerAhead"
"1",0.550990738464595,"Negative","Idea AMD overnight swing to"
"2",0.513585016254091,"Positive","JanstockMarket overview and stockTrading ideasStocks listed SPY GME NIO BABA PDD PLTR AMC INTC AMD AAPL BB FBStockMarketAnalysis StocksToWatch Stock Investing StocksToTrade OptionTrading NIO alibaba gamestop"
"2",0.516471558740191,"Positive","AMD update Now atfromhighsThat is why I cut if no breakoutMoney Saved is money madeLets see what they get on the callI doubt it will have power to breakfor nowYou never know though Will see"
"1",0.571004636284707,"Negative","Stock Market going crazy Let’s get this motherfucking money AMD AMC TWTR GME the suites and SOyou the GOAT"
"1",0.508239913450474,"Neutral","AMD TRADING StockMarket AMDAdvanced Micro Devices Q EarningsQ Adj EPSest Q RevenueBln estBlnSeesAdj Gross Margin Aroundest"
"2",0.559853456988965,"Positive","Oh my AMD MSFT NIO GE tomorrow is gonna be fun"
"2",0.623587585197869,"Positive","AMD still love this stock This should move pastin no time"
"1",0.530214234357769,"Negative","AMD was inside on the day but had earnings after the close and is all over the place MSFT is neither"
"1",0.535849816066192,"Negative","GMEBBBYAMC All of these are ripping off of Reddit short hype and AMD crushes estimates and is down overBrilliant"
"2",0.517059216685115,"Positive","AMD will open high tomorrow be patient everybody PTFeb"
"1",0.630670907908516,"Negative","AMD Coming down a little now in after hours But looks to be settling down Looking for it to hold these levels tomorrow Thinking there may be some price target upgrades from some analysts"
"1",0.645442892034766,"Negative","Looks like AMD just completed the both of those nextwave points Paul"
"1",0.561963791452669,"Negative","Get the WHOLE premarket and afterhours TSLA AAPL MSFT AMZN NIO PLTR GME BB GEVO BNGO PLUG GHIV NFLX WWR LAC AMD NVDA GM FB RIOT BABA XPEV NNDM CCIV SNDL F FCEL SPI DKNG PENN SUNW TRIT AMCI AVGR CIDM SPCE BBBY WMT"
"1",0.531852100961411,"Negative","amd strong earningsWill fly higher in a few weeks"
"1",0.524609607534775,"Negative","Massive upgrades coming in amd txn"
"1",0.614063663593118,"Negative","amd very long into the printExpectto get taken out and target"
"2",0.619364188589295,"Positive","Hard part of earnings AmD and msft both beat but one breaks out and one consolidates can’t win if you don’t play though"
"2",0.594491425791962,"Positive","Earnings will always be the most confusing thing in the world here we have two companies msft and amd both beat earnings bybillion dollars One pumps and one dumps LOL if anything amd is more impressive to beat earnings bybillion"
"2",0.597023685062341,"Positive","Heres what I still fail to understand You have one company that buys outdated games for outdated consoles for pennies on the dollar and then you have AMD which blew away earnings and they go down after hours Sometimes"
"1",0.571112366769732,"Negative","I think CT starts helping the Autistic Apes on WallStreetBets and starts Aping into Calls on heavily shorted stocks AMDBBNOK next"
"1",0.505282932499728,"Neutral","AMDIf it falls fromit will reachand there is a good area to buy it"
"1",0.513804593527926,"Negative","AMDOr to buy above"
"1",0.514155414641793,"Negative","AMDQ  amd earnings"
"1",0.551047982280851,"Negative","MSFT and AMD had earnings today but I don’t think anyone cares"
"2",0.502922088862874,"Neutral","Hey wallstreetbets I heard Melvin and Citron are short AMD you should should teach them a lesson before open tomorrow"
"1",0.508918219228888,"Neutral","I am BEGGING AMD"
"1",0.540489505442271,"Negative","AMD is green again Im taking credit for this"
"1",0.519504174917925,"Negative","amd too expensive"
"2",0.541414244751034,"Positive","Wrong Shorts atwere lined up AMD still has plenty of short interestwont be easy"
"1",0.519097581095683,"Negative","I’m sticking with BB and AMD currently as reddit’s saying they’ll be the next GME"
"2",0.505572214700982,"Neutral","AMD with no one at the party on a good earning day They raving at GME AMC FUBO MSFT NOK BB"
"2",0.584983009168695,"Positive","Love this chartI remember years ago when AMD did this in reverse"
"2",0.519780983766707,"Positive","Another great quarter from AMDUnfortunately the stock is down again but with the current setup will be really hard to remain underin the nextweeks"
"1",0.519461009977691,"Negative","AMDAfter hours PM EST"
"1",0.55559422309554,"Negative","Now that AMD AMD is screwing many of us who decided to hold through earnings on to the next FUBO FUBO"
"1",0.514444031475023,"Negative","Short Squeezes JampJ Microsoft and AMD Earnings APIWhats up in Markets GME APA SPY AMD"
"1",0.513926885811304,"Negative","AMD AMC GME I quit the market lmaooo TO THE MOON"
"1",0.514041140982216,"Negative","AMDGuidance Ingresos Q MM vs M estAfter hoursAMD INTC"
"2",0.531548482904299,"Positive","One point is that I think AMD doesnt currently realize the potential share gain they could make in PCs as none of us have been able to buy any of their new offerings for three months If they could have a product in stock they might be surprised at the take rate"
"1",0.513863723765721,"Negative","AMD amazing points AMD cnbc Wallstreet"
"2",0.5336070910814,"Positive","beats earnings estimates — Server CPUs and game console chips were upyearoveryear tobillion AMD revenue was upinand the company said it expectsrevenue growth in AMDtechcomputing"
"1",0.519445212549493,"Negative","amd guess crush me"
"1",0.667948674552829,"Negative","I day traded AMD yesterday like crazy and sold before close after good profits I just restarted a position in low s after their kick ass ER Absolutely no reason to drop after such results amp guidance However if the market decides to give cheapiesBUY"
"1",0.524876439727742,"Negative","AMD is the easiest AH buy of all time holy shit"
"1",0.513926885806915,"Negative","AMD reported earnings ofconsensus wasEarnings Whisper waswhisperbeat"
"1",0.552004262905317,"Negative","TSM is one of my favorite companies And favorite semi Long since ish Also like NVDA ASML AMD"
"2",0.501935537469757,"Neutral","AMD set records for annual amp quarterly mobile processor unit shipments as Ryzennotebook shipments continued to ramp withnotebook designs launched inAMD on track to increase the number of notebook designs powered by Ryzenprocessors to drive further growth"
"1",0.500136150105154,"Neutral","AMD seeing very strong demand for our new RadeonGPUs"
"1",0.510437268231222,"Negative","AMD semicustom sales increased yy and qq based on strong demand for nextgeneration Sony and Microsoft consoles"
"1",0.513193967191052,"Negative","AMD FY and Q’ results demonstrate the growing momentum and robust demand for our leadership highperformance computing portfolio AMD is very wellpositioned to build on this momentum in"
"2",0.516092877307847,"Positive","AMD desktop CPU revenue grew yearoveryear and sequentially driven by strong demand across our Ryzen processor family"
"1",0.528971676959026,"Negative","AMD Q’ GAAP Operating Income wasmillion upyy while NonGAAP Operating Income wasmillion also upyy"
"1",0.502780869216121,"Neutral","AMD Q’ Operating Cash Flow ofmillion Record Free Cash Flow ofmillion"
"2",0.548660978296288,"Positive","AMD GAAP Net Income was B and diluted EPS wasper share including a tax benefit of B orper share from an income tax valuation allowance releaseNonGAAP Net Income wasmillion upyy and diluted EPS wasper share upyy"
"1",0.508519514524386,"Neutral","AMD Q’ Enterprise Embedded and SemiCustom segment revenue was B upyy andqq"
"1",0.575100256645762,"Negative","AMD out atso Pennys from after hours high if not the high sell print attodayjust acts heavy amp has for quite a while NEXT"
"1",0.508804810860472,"Neutral","AMC took AMD profits"
"1",0.535245376886079,"Negative","AMDWelp there goes my unrealized PnL"
"2",0.504017120716052,"Neutral","AMD stock price will go higher after a week from earning announcements as per its tradition and Lisa Su comes on s show"
"1",0.55219036462925,"Negative","Nobody saw this coming so we cant cry"
"2",0.507081751037498,"Neutral","AMD confrence call if you are interested"
"1",0.529545577354838,"Negative","Bot amd todayand sold ahI couldve got outif I wasnt out in that damn snow"
"1",0.545284303138297,"Negative","The count thinks AMD investors made a mistake after their impressive earnings AMC saveAMC"
"1",0.575943850613192,"Negative","Thinking AMD May cook off tofor a bit If not caught a good run in it"
"1",0.519328234038209,"Negative","Lisa Su AMD on Squawk on the StreetAM tomorrow"
"1",0.514041140982216,"Negative","Tomorrow’s watchlist for NYSE NASDAQ betweenandAMD JD"
"1",0.505589398807736,"Neutral","AMD Pulling back"
